ID,Source_File,Newspaper,Date,Length,Author,Headline,Article,Newspapertype,Rightwing,year_month,Solidarity,Category
3234,urc_theindependent_raw4.docx,The Independent,29/6/2022,1145 words,Matt Mathers,Inside Politics: Noisy court,"Wimbledon is well underway, with Serena Williams and Harmony Tan serving up a cracking match in SW19 last night. Boris Johnson is contending with a noisy court at home, as defence secretary Ben Wallace ramps up calls for extra spending as the PM attends the Nato summit in Madrid. Elsewhere, Nicola Sturgeon has set out a proposed date for a second referendum on Scottish independence.  Inside the bubble   Our political commentator Andrew Grice on what to look out for today:  There’s no cabinet meeting this week, and so no opportunity for the ministerial mice to play while Boris Johnson continues his eight-day, three-summit tour at Nato’s meeting in Madrid. But prime minister’s questions carries on in his absence, as a battle of the deputies: Dominic Raab versus Angela Rayner. The deputy PM will come armed with Rayner’s supportive remarks about strikes. Questions to Scottish Office ministers will cover Nicola Sturgeon’s plans for an independence referendum in October next year. Ministers appearing at select committees include George Eustice (on environmental protection); Richard Harrington (Ukrainian refugees) and Anne-Marie Trevelyan (the trade deal with Australia). Sajid Javid will announce a digital health and care plan to tackle Covid backlogs. Lisa Nandy, the shadow levelling up secretary, will address the Local Government Association’s conference in Harrogate on the financial problems facing councils.  Daily Briefing   With or without you  Nicola Sturgeon is proposing 19 October 2023 as the date for another referendum on Scottish independence. The SNP leader, who said the question would be the same as the one on the last ballot – “Should Scotland be an independent country?”, has written to Boris Johnson asking for permission to hold the vote. This is because UK constitutional matters are reserved for the government in London. So far, the prime minister has refused to grant something called a section 30 order, which would give Sturgeon the power to hold the vote, saying that now is not the time for another divisive election campaign – some 8 years after Scots voted to stay in the union. That position is unlikely to change following the SNP leader’s address to SNPs in Holyrood yesterday. In a move that has somewhat blindsided Johnson, Sturgeon conceded that the legality of holding a second referendum without consent from London – a “wildcat poll”, like the one seen in Spain’s Catalonia region in 2017 – was contested and demanded an urgent ruling from the supreme court in London. “What I am not willing to do, what I will never do, is allow Scottish democracy to be a prisoner of Boris Johnson or any prime minister,” Sturgeon said. Whatever your views on Scottish independence, the move by Sturgeon is clever politics for several reasons. Firstly, it eases pressure on the FM from the grassroots of her party, who are demanding another poll despite most recent polls showing that there is no majority for independence. Secondly, Sturgeon has got ahead by referring the matter herself to the court, where the issue probably would have ended up anyway. If judges rule that the vote is legal, she gets what she wants and the poll goes ahead. If they don’t, then Sturgeon will use the decision as a recruiting sergeant for the independence cause and she has vowed to fight the next general election campaign on that single issue. If she wins that election with a majority she will then say that she has a democratic mandate for independence. One way or the other, it looks like there will be a vote on Scotland’s future. The court has confirmed that it has received the referral from the Scottish government’s lord advocate, although it did not put a date on when it would respond.  Defence row  Johnson, with his in-tray already overflowing, responded to Sturgeon’s call by saying that she should focus on getting the economy back on track as he argued that the UK is “stronger together”. The PM is well into his sojourn abroad as questions about his future continue at home. He landed in Madrid last night for the Nato summit and will meet with other leaders there today to discuss Vladimir Putin’s war in Ukraine. But his trip on the world stage threatens to be overshadowed by yet another cabinet row –this time on defence spending. As the PM issued a grand call to his counterparts at the summit to step up Nato spending, Ben Wallace, his own defence secretary, criticised the UK’s “smoke and mirrors” military budget. Wallace said UK forces had for too long survived on “a diet of smoke and mirrors, hollowed-out formations and fantasy savings” – after calling for the PM to commit to a 20 per cent spending increase. “If governments historically responded every time the NHS has a winter crisis so must they when the threat to the very security which underpins our way of life increases,” Wallace told the Royal United Services Institute think tank. Labour also accused the PM of “breaking” his own 2019 manifesto promise on defence spending, after a senior government source said the pledge to hike annual military spending by 0.5 per cent above inflation may no longer be met.  On the record  “My determination is to secure a process that allows the people of Scotland, whether yes, no or yet to be decided, to express their views in a legal, constitutional referendum so the majority view can be established fairly and democratically.”  Sturgeon sets out date for second referendum campaign.   From the Twitterati  “The fact the Met is now formally in special measures makes it seem all the more remarkable that Boris Johnson and Priti Patel were so keen to keep Cressida Dick in post.”  George Parker, FT politics editor, on the news that the Metropolitan Police service has been placed in special measures.   Essential reading   John Rentoul, The Independent: Nicola Sturgeon has told her party what it doesn’t want to hear on a second independence referendum Jess Phillips, The Independent: I don’t regret my abortion – stop trying to make women feel guilty for being angry about Roe v Wade Marina Hyde, The Guardian: In this government by Grand Designs, Johnson has spaffed the budget and the roof is leaking Hamish McRae, The Independent: What happens to Europe if Russia cuts off the gas?  Sign up here to receive this free briefing in your email inbox each weekday ",Broadsheet,0,2022-06,NA,NA
2839,urc_theindependent_raw3.docx,The Independent,12/4/2022,626 words,Shweta Sharma,"Putin 'resettling Ukrainians 5,500 miles away in Siberia and far east Russia' -report","Vladimir Putin has sent almost 100,000 Ukrainian refugees thousands of miles away from their home, to resettle in remote corners of Russia , including Siberia and the Arctic Circle , according to Kremlin documents.  Moscow made the emergency order last month to move 95,739 people of the Russian Federation, Ukraine , Donetsk, and Lugansk away from the war zones to be resettled as far as 5,500 miles away from their homes, the Kremlin decree seen by The i stated. It comes amid several reports that Russian forces have allegedly forcibly disappeared, held captive or interrogated people in Ukrainian towns since Mr Putin's invasion of the country on 24 February.  The decree stated that ""taking into account the current situation"" in Ukraine, the Russian federation ""approves the distribution"" of citizens to the ""constituent entities of the Russian Federation"" and asked authorities to ""ensure the reception"" of 95,739 people. It included provisions to send 11,398 people to Siberia, 7,218 to the Far East and 7,023 to the North Caucasus, including other regions such as the heavily-militarised republics of Chechnya, Ingushetia and Dagestan. Citing separate documents, the report added that people in the port city of Mariupol were being asked to sign papers that claimed Ukrainian troops shelled their city. The signatories were reportedly told they cannot return to Ukraine because they will face ""persecution"". The number of Ukrainians that have been internally displaced has reachedover 7.1 million since the invasion of the country, according to the International Organisation for Migration. Sima Bahous, director of UN Women, said the ""mass displacement with the large presence of conscripts and mercenaries, and the brutality displayed against Ukrainian civilians, has raised all red flags"". Demanding an end to the war, she said: ""We are increasingly hearing of rape and sexual violence. These allegations must be independently investigated to ensure justice and accountability."" Meanwhile, an eight-mile convoy of Russian troops seen in satellite imagery heading towards Ukraine's Donbas region is the latest evidence to Ukrainian president Volodymyr Zelensky's claim that Russia is preparing for renewed attacks. Mr Zelensky said Russia's war on Ukraine could be entering a ""new stage of terror"" citing threats from the use of chemical weapons in the besieged city of Mariupol. The Ukrainian parliament also said that it received reports of Russian forces firing ""nitric acid"" in the Donetsk region. It follows inputs from British intelligence on Monday that warned of the potential use of phosphorous by Russian forces in Mariupol. The US Defence Department has said they are monitoring the unconfirmed reports of the use of chemical munitions. ""These reports, if true, are deeply concerning and reflective of concerns that we have had about Russia's potential to use a variety of riot control agents, including tear gas mixed with chemical agents, in Ukraine,"" Pentagon press secretary John Kirby said.  The Independent has a proud history of campaigning for the rights of the most vulnerable, and we first ran our Refugees Welcome campaign during the war in Syria in 2015. Now, as we renew our campaign and launch this petition in the wake of the unfolding Ukrainian crisis, we are calling on the government to go further and faster to ensure help is delivered.   To find out more about our Refugees Welcome campaign, click here . To sign the petition click here . If you would like to donate then please click here for our GoFundMe page. ",Broadsheet,0,2022-04,1,Migration
2714,urc_theindependent_raw2.docx,The Independent,14/5/2022,444 words,Thomas Kingsley,"Fifty migrants told they will be sent to Rwanda, Boris Johnson says","Boris Johnson has revealed that the first 50 migrants have been told they will be sent to Rwanda within two weeks.  The policy has been widely criticised by human rights charities and even faced backlash from Tory backbenchers, former prime minister Theresa May and the Archbishop of Canterbury.  The government said it is braced for a flurry of legal claims as it prepares to send migrants to the east African nation within a fortnight. In the interview with the Daily Mail, Mr Johnson said the migrants have already been served ""notices of intent,"" marking the start of the process. ""There's going to be a lot of legal opposition from the types of firms that for a long time have been taking taxpayers' money to mount these sorts of cases, and to thwart the will of the people, the will of parliament,"" Mr Johnson said.  ""We're ready for that. We will dig in for the fight - we will make it work. We've got a huge flowchart of things we have to do to deal with it with the leftie lawyers."" The controversial policy has faced heavy scrutiny since it was announced with the latest reports claimingLGBT+ refugees sent to Rwanda could face persecution and Ukrainian refugees fleeing Russia's invasion could also be sent to east Africa.  The Home Office's equality impact assessment for the policy, published this week, states that there are ""concerns"" over the treatment of some LGBTQ+ people, and that investigations point to ""ill treatment"" of this group being ""more than a one-off"". The document also reveals that some asylum seekers in Rwanda are forced to wait years for a decision and two-thirds are ultimately rejected. Meanwhile, immigration minister Tom Pursglove said that decisions to ship asylum seekers to the east African country would be considered on a ""case by case basis"" - and did not deny that people who have fled Ukraine could be among them. During an evidence hearing with the Home Affairs Select Committee, he also declined to rule out that Afghan nationals who worked alongside the British Army could be deported under the policy. Asked whether refugees who have escaped the Russian invasion could be among the cohort relocated, Mr Pursglove said: ""There is absolutely no reason why any Ukrainian should be getting in a small boat, paying a smuggler to get to the UK. ""People should be using those safe and legal routes that are available. We look at cases on a case by cases basis, but it is crucial to get the message across that people should be using the safe and legal routes if they come from Ukraine. It would be absurd to do otherwise."" Home Office figures suggest 28,526 people cross the English Channel in 2021, up from 8,466 the year before.",Broadsheet,0,2022-05,0,Policy
2663,urc_theindependent_raw2.docx,The Independent,26/2/2022,1014 words,Via AP news wire,Prayers and despair: Ukrainians in the US decry invasion,"The Rev. Myron Myronyuk stayed up all night at home in Pennsylvania as his twin brother tried to flee Kyiv , the Ukrainian capital, only to turn back because the road out was choked with traffic. His in-laws, also in Ukraine, told him they couldn't get basics like bread and milk. There was little Myronyuk could do but pray that his loved ones would survive the Russian invasion of Ukraine. A sense of helplessness overcame Ukrainians in America as the war unfolded half a world away, with little chance their loved ones in Ukraine would find refuge in the U.S. any time soon. For now, they are trying to donate money and supplies, desperately seeking advice from immigration attorneys about how to get family here and pleading for world leaders to intervene more forcefully. ""I say, 'We're praying for you, we wish you to be safe, go to a safe place,'"" said Myronyuk, pastor of St. Vladimir Ukrainian Catholic Church in Scranton, Pennsylvania. ""We have to continue to pray and ask God for help,"" he said, but ""there's not much else we can do here."" Demonstrators gathered in Manhattan's Times Square and near the Russian Federation's mission to the United Nations on Thursday, waving blue-and-yellow Ukrainian flags and denouncing Russian President Vladimir Putin. About 100 people took to an overpass in Chicago , putting their hands to their hearts as the Ukrainian national anthem blared from a big speaker. ""The worst part is we cannot help them any more. We would send money, but everything is closed,"" said Chicago resident Hrystyna Klym, who has been in the U.S. for 15 years and has family in Ukraine. Klym volunteers with an organization that has regularly sent clothes, magazines, money and other items to help Ukraine's needy, particularly wounded soldiers, but she said there's no way to donate directly now. At Ukrainian Village Food & Deli in the Cleveland suburb of Parma Heights, Mila Radeva, 39, said her father - who lives near the Ukrainian port city of Odessa - had taken shelter in his basement as explosions rocked the area. ""A lot of people are going to die,"" said a worried Radeva, who emigrated to the U.S. 20 years ago. Asked if her father and other relatives might flee to another country, she said: ""There's no place for them to run."" Ekaterina Mouratova, a Miami immigration attorney, said Thursday was ""a crazy day,"" with phone calls and emails from Ukrainians and Russians seeking refuge in the United States. Ukrainians hope to flee Russian troops, while Russians worry they may get drafted and have bank accounts frozen in a wartime economy. She offered little encouragement, predicting Poland would be a far more realistic possibility for escape. ""There is no effective legal mechanism to bring people here,"" she said. Ukrainians could potentially flee their country, fly to Mexico from Europe as tourists, and enter the U.S. by land to claim asylum, as a growing number of Russians have done over the last year, Mouratova said. Fleeing war, however, is not considered legal grounds for asylum. Ukrainians could also be eligible for refugee resettlement - under which up to 125,000 can be accepted in the U.S. this year after being approved abroad - but processing has been slow as U.S. authorities focus on Afghans seeking to flee Taliban rule. White House press secretary Jen Psaki said the U.S. was prepared to accept Ukrainian refugees, ""but we certainly expect that most if not the majority will want to go to Europe and neighboring countries."" Immigration advocates urged the Biden administration to grant Temporary Protected Status to Ukraine, a form of reprieve for its citizens already in the United States. The U.S. has granted TPS to 12 countries afflicted by war or natural disaster. Chicago immigration attorney Natalia Blauvelt, who also fielded calls from desperate Ukrainian clients, potential clients and friends, said they are ""absolutely devastated, extremely sad.... They are panicking because of what is happening in Ukraine, and many of them don't know what to do and help their relatives."" More than 1 million people in the U.S. report Ukrainian ancestry, according to the Census, with sizable populations in New York City, Chicago, Seattle, Sacramento and Los Angeles. Oksana Bilobran, an attorney in Seattle's Office of Immigrant and Refugee Affairs, came to the U.S. from Ukraine 17 years ago. She and others have been urging elected officials to do more to support Ukraine, including securing a no-fly zone over the country and providing humanitarian protection for Ukrainians currently in the U.S. so they don't have to return. They are also working on ways to support Ukraine financially, since apps like Venmo and PayPal aren't readily available there. ""We need to up our fundraising to provide necessities, because the Ukrainian military is no match for the Russian army, so we need to provide as much help as we can here,"" she said. In Philadelphia, the United Ukrainian American Relief Committee - formed in World War II to help resettle Ukrainian refugees - pivoted to a wartime footing once again, readying a container packed with clothing, diapers, wheelchairs, medical supplies and personal hygiene items. Donations had increased over the past several weeks as Russia massed its military on Ukraine's doorstep, according to the executive director, Motrja Watters. The group plans to send the container to Ukraine, or Poland if Russia blocks humanitarian aid. Watters, whose parents were born in Ukraine, said relief groups are coordinating their response so aid is delivered as effectively as possible. ""Everybody's trying to get a grip on the how and the where the needs are in Ukraine,"" she said. ""We're working around the clock... There are so many people already injured, families already split up, and those are the people we need to help right now."" ___ Rubinkam reported from northeastern Pennsylvania and Spagat reported from San Diego. Associated Press reporters Don Babwin and Sophia Tareen in Chicago, Mark Gillispie in Parma Heights, Ohio, Gene Johnson in Seattle and Deepti Hajela in New York contributed to this story.",Broadsheet,0,2022-02,1,Conditions
2092,urc_theindependent_raw1.docx,The Independent,31/3/2022,430 words,Craig Paton,"Empty military homes must be option to house Ukrainian refugees, says Sturgeon","Military homes that are currently lying empty could help give ""true sanctuary"" to Ukrainians fleeing the war in their homeland, Nicola Sturgeon has said. The Scottish First Minister said the option of housing refugees from the war in vacant military properties owned by the Ministry of Defence (MoD) ""must"" be considered. Speaking in the Scottish Parliament she said: ""The humanitarian crisis here and the scale of it means it is important that all housing options are fully explored. ""I believe MoD housing should be, must be, considered as part of this process."" She was asked about the issue by SNP MSP, Gordon MacDonald, who has already written to the Defence Secretary, Ben Wallace , urging him to bring some 11,000 MoD homes that are not currently occupied, back into use. The Edinburgh Pentland MSP said: ""In my constituency, around the Dreghorn and Redford barracks, there are many MoD family homes that have been left empty for many years."" And he asked the First Minister to support his call for the ""UK Government to consider the use of hundreds of empty MoD homes in Edinburgh and across Scotland to house people being displaced as a result of Russia's war in Ukraine"". Ms Sturgeon said while the UK Government has sole responsibility for MoD properties, she would welcome ""making empty homes available to support displaced people from Ukraine"". We manage up to 16,000 service family moves every year, we need to retain vacant homes across the UK, but we are looking at what we can do around this MoD spokesman Speaking at First Minister's Questions, she added: ""The Scottish Government is already bringing together key partners to ensure effective co-ordination of plans to address the accommodation needs of people who are settling in Scotland, so we are committed to working with all partners to ensure all arrangements in place are safe, sustainable and offer true sanctuary for those fleeing the war."" In his letter to the Defence Secretary, Mr MacDonald said that"" it would be a failure of the Ministry of Defence not to utilise these properties to provide a safe, warm home for displaced Ukrainian people"". He urged the UK Government to ""take this forward as a priority, working with the Scottish Government and the local authorities"". An MoD spokesman said: ""The UK Government's Homes for Ukraine scheme has seen an unprecedented surge of public support, with sponsorship offers from across all four nations of the UK. ""As we manage up to 16,000 service family moves every year, we need to retain vacant homes across the UK, but we are looking at what we can do around this.""",Broadsheet,0,2022-03,1,Policy
