ID,Source_File,Newspaper,Date,Length,Author,Headline,Article,Newspapertype,Rightwing,year_month,Solidarity,Category
1203,urc_theguardian_raw1.docx,The Guardian,16/6/2022,989 words,Emily Dugan,"Hundreds of Ukrainian refugees left homeless in England, data shows","Hundreds of Ukrainian families have been left homeless in England after arriving on visas designed to secure them a place to live, official figures reveal. Since the end of February, at least 480 Ukrainian families with children and 180 single adults have applied to councils for help with homelessness. Despite the government insisting that the Homes for Ukraine and family visa schemes would ensure that refugees had housing, both are leaving people struggling when arrangements break down. The data exposes the cracks already appearing in the Homes for Ukraine scheme, with 145 placements having ended in homelessness by 3 June. Of these, 90 ended because the arrangement broke down and a further 55 never got off the ground properly because the accommodation was unavailable or unsuitable on arrival. Lauren Scott, executive director of Refugees at Home, said: “We are frustrated and saddened but not surprised to see placements start to break down. Expecting vulnerable, traumatised refugees to rely on the goodwill of strangers they have met on Facebook was always a risk. “We urgently need a joined-up national fallback plan to help families whose placements go wrong. Across the country there is no consistent approach to rematching guests with new hosts, no standard way for Ukrainians to change their visa sponsors, and no single mechanism for moving funding from one host to another.” Many local authorities are treating Ukrainian families as homeless rather than attempting to rematch them with new hosts, leaving them in hostels and hotels, just as happened with Afghan refugees. Of the 145 failed Homes for Ukraine placements, only 20 were rematched with a new host. Scott said: “It is a nightmare situation – the very one that we had hoped to avoid.” Anna, 37, fled Kyiv with her husband and their three-year-old son when war broke out. They came to Britain at the end of March after matching with a family of four who lived in a large house in Northampton. After initially being welcoming, their hosts became less enthusiastic within a few weeks. “We didn’t understand what was happening because they changed their mood very quickly,” Anna said. Anna and her family were moved into an annexe. The host said he wanted a key to it and they agreed as long as he warned them before going in, but shortly afterwards he called the council to say he wanted to terminate his sponsorship. “They didn’t explain anything to us,” Anna said. “They were not ready to share their house. They tried to get rid of us as soon as possible.” Her family were put up in a Travelodge for several days by the council, sharing one room with no cooking facilities. They had no idea where to go. “We were desperate and felt we didn’t have any other options than to go back to Ukraine,” Anna said. Finally, after trawling the internet, they found Refugees at Home, who helped place them with another family. They are still scarred from the experience. “We lost our home in Ukraine, and when we came here we thought that we were safe, but actually we weren’t and we lost our home a second time.” The family visa scheme, which has been running the longest, accounted for 455 homeless applications. In many cases, families desperate to get their relatives out of Ukraine applied for visas but never had room for them to stay. The chief executive of the Refugee Council, Enver Solomon, said: “It is worrying to see that desperate Ukrainian families who have fled war, endured trauma and heartbreak, arriving here, entrusting their safety in our hands, to have been left to fall into homelessness. “Ukrainian families arriving here need a warm welcome, safe housing and benefits, emotional support, and connection. We’re concerned that Ukrainians arriving on family visas are running into problems as not all relatives will have the space or the resources to support their family members – which is why there needs to be the same level of funding available to them and local councils as is provided under the Homes for Ukraine scheme.” Lisa Nandy MP, shadow levelling up and housing secretary, said: “It is utterly shameful that families that have fled Putin’s brutal war have found themselves homeless here in the UK. “The British people showed amazing generosity in stepping up in their thousands to provide the care and sanctuary that these people – many of them families with young children – needed and deserved in such awful circumstances. “But the government has failed miserably to play its part. Ministers were warned about the risk of refugees becoming homeless on the day they launched the sponsorship scheme, but they were more interested in grandstanding in television studios than doing their jobs to protect vulnerable people. “The government must urgently set out a plan to support councils to find safe homes for these families.” Cllr David Renard, housing spokesperson for the Local Government Association, said: “Currently, councils receive no data on, or funding for, people who are coming under the family visa scheme. Some of those families present as homeless once they have arrived, but we are asking that they should be able to be rematched with a sponsor under the Homes for Ukraine scheme. “Urgent work is needed on how councils can work with government and the community, faith and voluntary sector so those offering their homes can be quickly matched with a family in need.” A government spokesperson said: “More than 77,200 Ukrainians have arrived in the UK since Putin’s invasion and all arrivals have access to benefits and public services, as well as the right to work or study, from the day they arrive. “The overwhelming majority of people are settling in well, but in the minority of cases where family or sponsor relationships break down, councils have a duty to ensure families are not left without a roof over their head. Councils also have access to a rematching service to find a new sponsor in cases under the Homes for Ukraine scheme.”",Broadsheet,0,2022-06,0,Conditions
1247,urc_theguardian_raw1.docx,The Guardian,28/3/2022,785 words,Amelia Gentleman and Josh Halliday,"UK visa rule leaving refugees stranded in war-torn Ukraine, say charities","Leading refugee charities have called on the UK government to scrap visa requirements for Ukrainian refugees, amid mounting anger about the government's slow progress in issuing paperwork to people fleeing a war zone. Applicants to host Ukrainian refugees under the Homes for Ukraine scheme have expressed concern that some refugees are being forced to remain in the conflict zone while UK visas are processed. A Conservative councillor resigned from the party at the weekend after being shocked at the red tape surrounding the UK's Ukraine visa system, which she said reflected the government's ""hostile"" and ""xenophobic"" approach to refugees. Samantha Flower has applied to sponsor a 17-year-old Ukrainian boy to live with her family in Buxton, Derbyshire, but said she had been met by delays and bureaucracy. The child has been forced to remain in Ukraine while the paperwork is processed. ""If he doesn't make it out alive, it's because the red tape prevented it,"" she said. Her unease was reflected by the statement from the heads of the Refugee Council, the British Red Cross, Save the Children and Oxfam who warned that the visa system was ""causing great distress to already traumatised Ukrainians"". ""Those who want to come to the UK are having to navigate a complex web of bureaucratic paperwork to get visas, leaving them facing protracted delays without any information about the status of their application,"" the charity heads wrote in a letter published on Monday in the Times. ""The government must urgently review the use of visas and waive them as an immediate short-term measure, as has been done by the EU, and look to introduce a simplified emergency humanitarian visa process."" Flower, a councillor on High Peak borough council, has signed up to the UK's Home for Ukraine scheme , where strangers act as hosts, but has not yet been approved. Only 1,000 of the 25,000 completed applications have been approved so far. The boy and his stepmother and father, both lawyers, fled their home in Kyiv when Russia invaded. They arranged for the teenager to travel to the UK after contacting Flower online, where the councillor had offered her home. However, the boy has only a domestic Ukrainian passport and not the international passport required by the UK as part of its visa process. The boy's family have had to stay in Ukraine and wait for the correct paperwork - a process they have been told could take weeks. ""They're having to wait for the passport to be completed,"" said Flower. ""They had a shell land near their home five or six days ago. They don't know from one day to the other what's going to happen."" She said the government's complex visa system for Ukrainians reflected its ""hostile"" approach to all refugees, adding: ""We're tipping towards being quite far right and it's not the party that I joined."" More than 3.9 million refugees have left Ukraine in the past month, according to the United Nations high commissioner for refugees, more than 2.2 million of whom have ended up in Poland. The Home Office has granted 21,600 visas to Ukrainians who are hoping to join relatives in Britain under the Ukraine Family scheme. The Department for Levelling Up, which is handling the parallel Homes for Ukraine scheme, for people who do not have family in the UK, has not yet released any figures about the number of visas granted. However, refugee hosting charities say the numbers of people coming through this scheme are so far ""tiny"". Lauren Scott, director of hosting charity Refugees at Home, said: ""We have been told anecdotally that the delay is largely down to the onerous visa application process, which is frustrating for our hosts and must be soul-destroying for guests. It is creating a huge bottleneck. So far we only know of three sponsorship visas granted to potential guests, and that's all to one family."" An opinion poll released on Sunday by Savanta ComRes indicated that 54% of people in the UK support a no-visa policy, and would like to allow an unlimited number of Ukrainians who are fleeing the Russian invasion to come to the UK. Despite concerns over the slowness of the process for granting visas to Ukrainian refugees, organisations working to resettle Afghan refugees who were airlifted from Kabul last August have asked the Homes for Ukraine scheme to be extended to allow households also to host Afghan families. In a letter to Michael Gove, secretary of state for levelling up, 50 signatories - including the head of the Refugee Council and former Conservative ministers Robert Buckland, Damian Green, Johnny Mercer and Caroline Nokes - called on the government to permit some of the 12,000 Afghans who are still being accommodated in hotels to be hosted in residential homes.",Broadsheet,0,2022-03,1,Policy
1440,urc_theguardian_raw1.docx,The Guardian,25/4/2022,642 words,Diane Taylor,Ukrainian refugee left homeless after UK host demanded bill money,"A Ukrainian refugee has been left homeless just days after moving in with a host in Brighton who demanded money from her to pay for utility bills. Olha, 36, who asked for her real name not to be used, moved in with her host who had registered with the government's Homes for Ukraine scheme. But she was told to leave when she said she was unable to pay the money her host demanded. A Department for Levelling Up, Housing and Communities source said it was not acceptable for hosts to demand money from Ukrainian guests. Hosts can claim £350 a month from a government fund to cover the costs of hosting Ukrainian refugees. The deputy leader of Brighton and Hove city council, Hannah Clare, confirmed the council was aware of the case and condemned the government hosting scheme. ""The government's Homes for Ukraine scheme has been badly put together. Among its flaws is the fact that there is no mechanism for councils to transfer a Ukrainian guest to an alternative sponsor when something like this happens,"" she said. Olha, who was working in finance and economics before the war started, matched with a British woman in her 60s via a Facebook group and had registered with the government's Homes for Ukraine scheme. She fled her home in Dnipro on 28 March and began a dangerous and harrowing journey out of Ukraine by car. She arrived in Brighton about two weeks later. At first Olha thought things would go well with her host. She provided her with an evening meal when she arrived, but told her she would be expected to provide her own food after that.  But soon the host started demanding money and said Olha was costing her a lot in utility bills. ""She contacted the utility companies, asked them how much she had spent that week and told me that since I had arrived her energy bills had gone up a lot and that I needed to pay her £50 per week for energy bills. She said if I didn't want to pay her I had to leave,"" said Olha. ""I felt so upset I thought it would have been better for me to stay at home in Ukraine so that I wouldn't experience anything like this."" She left her host's home and has managed to find someone from a local church who offered to let her stay with her for a few days. ""I'm in a very difficult situation because my family are still in Ukraine. My brother is a soldier and my mother has refused to leave the country. I've received contradictory information about what I should do next. I don't want to scare other Ukrainians who are coming here but what happened to me is dreadful. It has caused me so much stress and made me feel totally unsafe. My host told me I needed to go. But where should I go? I have only just arrived in the UK."" According to the latest government data 6,600 people have arrived as part of the Ukraine sponsorship scheme with 39,300 visas for the initiative granted. Another 15,000 people have arrived under the Ukraine family scheme with 32,500 of these visas granted. Advice on the government website said sponsors should inform their local council if a hosting arrangement breaks down. Clare said: ""We are sadly aware of this really unfortunate situation. We understand that the woman in question is safe and has been helped by a local community group to find another place to live temporarily. We will do what we can to offer her support. ""Homes for Ukraine is a private matching scheme that is not mediated by councils. We have warned all along of the risk of some relationships breaking down and inappropriate hosts taking part due to a lack of proper oversight by the government. ""The scheme is at its heart deeply flawed. Councils have no control over when Ukrainian guests arrive in the city, nor do we get adequate notice. We rely on information from hosts about when refugees are arriving. With this in mind it isn't possible for councils to carry out property and welfare checks before guests arrive.""",Broadsheet,0,2022-04,0,Conditions
1548,urc_theguardian_raw1.docx,The Guardian,12/6/2022,1034 words,Nadia Beard in Tbilisi,Ukrainians who fled to Georgia reveal details of Russia’s ‘filtration camps’,"By the time it was Olena’s turn for interrogation, she had already spent three weeks cold, hungry and sleeping on the floor. Even so, it was the male Russian officer ordering her to take off her blouse for an inspection that she found the worst indignity of the ordeal fleeing her home in Mariupol, Ukraine. “Bruises on the shoulders could mean you’re a sniper,” Olena explains from a cafe in Tbilisi, Georgia. She was horrified. “I told him, I’m turning 60 years old this August. How could I be a sniper?” The officer didn’t seem to care. “I’m not wearing my glasses anyway,” he told her. “Take your top off now.” Stories like Olena’s from a filtration camp in Nikolske, a town in the self-proclaimed Donetsk people’s republic (DNR), are common among the growing number of Ukrainian refugees now in Georgia. Since the start of Russia’s invasion of Ukraine, an estimated 20,000 Ukrainians have entered Georgia, many arriving from Russia through Georgia’s northern Kazbegi mountain border. Unable to flee Russian-occupied cities such as Mariupol and Kherson westward into Ukrainian-held territory, many Ukrainians are left with a terrible dilemma: stay in your besieged city, or flee to the country that has destroyed your home. To enter Russia, many Ukrainians are forced through so-called filtration, a process during which they are photographed, interrogated, their fingerprints taken, and the contents of their phones scrutinised. Men are ordered to strip to their underwear, their bodies searched for tattoos that could reveal a link to Ukrainian nationalist groups. Everyone is questioned on whether they or anyone they know has served in the Ukrainian army. During Olena’s interrogation, she recalled how a guard questioning a man at the next table found a keyring bearing the image of the Ukrainian coat of arms. Four guards then beat the man savagely with batons and kicks to the head before throwing him outside in sub-zero temperatures without a coat or hat. Filtration camps have been set up across towns and villages mostly concentrated in the DNR, including Novoazovsk, Mangush, Bezimenne and Nikolske. Ukrainians fleeing Mariupol by bus often arrive at the filtration camps unknowingly, having been told they would be taken to Ukrainian-held cities instead. After arrival, they are usually not allowed to leave the town. Filtration usually ends in one of two ways: either you “pass” the interrogation and are handed a small, stamped piece of paper with the date of your filtration and the signature of the supervising officer, or you will be detained for further questioning. The “camps” occupy schools, cultural centres, sports halls and other public buildings. Conditions are often abject and the camps are poorly organised. People like Olena, who was travelling with her 65-year-old sister Tamara and Tamara’s 70-year-old husband and like others interviewed would not give her full name, slept first on the floor, then on a cardboard box. For the first few days there was one meal a day offered by the canteen. Then the Russians closed the canteen altogether and told them to find their own food. For Maksym and Iulia, from Mariupol, filtration was also a lengthy ordeal, though they were lucky to have been offered a house to stay in nearby that belonged to one of Maksym’s classmates. They spent almost a month waiting to be filtered in Mangush. “Our number in the queue was 347,” Maksym says. “You go in and ask what the number is today, and you realise the number only went down by two or three. Why was it so slow? The process itself takes around 30 minutes.” It was only after Maksym told a military pharmacist that they were running low on insulin for Iulia’s diabetes that their wait was expedited and they were filtered that afternoon. Waiting in a corridor, they saw a man in Ukrainian army fatigues being questioned on his knees, his hands tied behind his back. Others report a shorter wait time, with some Ukrainians spending only a day or two at the camps before filtration and onward travel to Russia. One 29-year-old couple, Igor and Valentina from Mariupol, report being filtered within six hours of arriving in Nikolske. “The fact my wife was nine months pregnant at the time and we had to get to a hospital as soon as possible probably helped speed things along,” Igor says. You have to tell them you want to stay and make a life in Russia, then they’ll leave you alone  Maksym  Ukrainians who subsequently escaped to Georgia have avoided the reportedly widespread forced deportations to Russian cities. One woman, Zhanna, told of how her family slipped out of a back door of a filtration centre unnoticed after overhearing an officer say that she, her husband and their young son would be deported to a Russian island near Japan. With only migration cards, not filtration papers, Zhanna and her family travelled by bus from Novoazovsk to Russia’s Taganrog. From Taganrog, they travelled by train to Vladikavkaz, and crossed into Georgia in a minivan through the border at Kazbegi. Others say that informing officers of concrete plans to go to a specific Russian city was enough for them to be allowed to make their own way to Russia, and then onwards to Georgia. “You have to tell them you want to stay and make a life in Russia, then they’ll leave you alone,” Maksym says. Most of the buses taking filtered Ukrainians from the DNR to Russia terminate at Taganrog. There, most buy bus or train tickets to Rostov-on-Don, from where they can organise onward transport. Those who come to Georgia travel south to Vladikavkaz before crossing over into Georgia through the mountain border. Even once they reach the Russian border, their exit is not guaranteed. Men are routinely taken out of the queue and interrogated, their phones examined. One man, Petya, reported being forced to pay the Russian border guards a bribe in exchange for an exit stamp. Many of the Ukrainians now in Tbilisi are biding their time until they can return home to Ukraine. “My goddaughter is still in Mariupol and sent me photos with crosses stuck into the ground everywhere. The graves are even in our courtyards,” Olena says. “I want to go home, but that means somewhere in Ukraine not occupied by Russians.”",Broadsheet,0,2022-06,0,Conditions
