ID,Source_File,Newspaper,Date,Length,Author,Headline,Article,Newspapertype,Rightwing,year_month,Solidarity,Category
3292,urc_theindependent_raw4.docx,The Independent,31/3/2022,1101 words,David Cohen,How Ukrainian pets bring solace for some refugees but heartbreak for others,"The abandoned dog at the Hungarian border was in a bad way, shaking and shivering and barely able to walk.  The Golden Retriever had pitched up seemingly out of nowhere that morning, passing through no-man's land to lay his weary head on a piece of covered tarmac just past the Csengersima checkpoint on the Hungarian-Rumanian border.  A woman from the Hungarian Red Cross bent down to offer him food, water and a kind word, but he was too weak to respond, so they called a local animal shelter to pick him up. Six hours later, he was still there.  It was a pitiful sight but also one that flew in the face of the extraordinary care we had seen the Ukrainian refugees show for the pets they had brought with them to escape theRussian bombs.  We had witnessed this during the second week of the invasion at several crossings on the Polish-Ukrainian border and again, in the last week at the Hungarian border - and many told us of the pain they felt about larger pets, mostly dogs, they had been forced to leave behind.  We watched as refugees who had queued for hours on foot carrying young children and their worldly possessions still found the wherewithal to physically carry their pet, often lugging them in pet carriers along with weighty supplies of pet food.  Frequently the ones carrying the pets were young children. Nobody knows exactly how many of the 4 million refugees who fled the country have taken pets, but pet travel specialists PBS Pet Travel estimate that more than 1.25 million pets have crossed the border.  One of the untold stories of this war is surely that of how taking care of a beloved pet at a time of personal and collective trauma can be a helpful, even healing, thing to do.  At Kroscienko on the Polish-Ukrainian border, where refugees endured sub-zero temperatures, we saw Olena Boiko, 39, emerge from her 20-hour journey from Kyiv with her Chihuahua, Dolores, peeking out of her coat.  At the same crossing we saw Vatazhok, 87, on crutches and her friend, Zhanna Zabrodska, 85, in a wheelchair, muster the energy to carry their respective cats, Syoma and Masha.  ""Come feel Masha shivering with cold through my rucksack,"" said Zhanna, tears streaming down her face for her struggling feline companion. The gritty octogenarians had travelled two days from embattled Kharkiv in the north after hiding in a freezing basement for 11 days and in fleeing to save themselves had thought to save their cats too.  There was also sadness for pets left behind. When Sasha Bubnovska, 28, crossed into Poland with her daughters Sofia, 6, and Mia, 2, and pug, Bella, after a four-day journey fleeing Irpin and leaving her husband at the border, her relief to be safe was palpable, but her thoughts were for her black Labrador, Clode, too big to fit in their car.  She showed me photos of Clode looking mournful as they left him lying on his own in front of the sofa. Sasha said: ""It is hard to look at these photos.""  They left house keys with a neighbour and asked him to put out food and water for Clode, but Sasha did not know the neighbour well and with Kharkiv under bombardment, she couldn't be sure if Clode was still alive. ""I am not sure I will see him again,"" she said. ""We brought Bella but Clode was part of our family. I feel I betrayed him.""  At a nearby refugee reception centre in Lodyna just over the Polish border, a young girl arrived with her mother after a long journey from eastern Ukraine and the first thing she did after being given a camp-bed was to feed and cuddle the rats in her pet carrier.  They immediately became a focal point and a way of connecting to other refugee children in the shelter. Elsewhere we saw several hamsters and even mice.  At the cavernous Bok Stadium in Budapest, a national sports centre being used as a filtration point for thousands of refugees arriving at Budapest train station, one of the charities was Animal Aid.   The Independent has set up a petition calling on the UK government to be at the forefront of the international community offering aid and support to those in Ukraine. To sign the petition click here .  They had set up a stand offering free pet food, professional advice and veterinary information.  A spokesman said: ""Ninety-nine per cent of the pets people have brought are dogs and cats, but we are seeing the odd rat.""  He held up a pet carrier with a very busy white rat that somebody had found abandoned and handed in just minutes before.  ""It's in good shape,"" he said. ""The cage is clean and well looked after. We don't know if it was left behind on purpose or accidentally.""  Other refugees were letting their canine pets stretch their legs and as they strutted across the blue floor of the sports centre alongside their owners, they looked as happy and well looked after as contestants for a Crufts international dog show at Alexandra Palace.  Initially the EU had imposed no limits on the number of pets refugees could take with them, and border officers allowed them to cross without papers, but according to anecdotal reports from aid volunteers, limits have now been imposed, not just at the Ukrainian border but in some onward countries, and this had led to a rise in pets being abandoned at the border.  Hester Berg, a volunteer who since the war began has driven four times from her home in Vienna to various points on the Ukrainian border to deliver a car full of pet food, said: ""Refugees have told us that they have changed the laws regarding pets. Initially you could have five animals per car but now they've cut down so some refugees are having to make a choice at the border between which pets to take and which to leave behind. In other cases, they get their pets through the Ukrainian border only to face a limit at the second EU country they enter. We have rescued 25 dogs at various border crossings. It's heart-breaking.""  The Independent has a proud history of campaigning for the rights of the most vulnerable, and we first ran our Refugees Welcome campaign during the war in Syria in 2015. Now, as we renew our campaign and launch this petition in the wake of the unfolding Ukrainian crisis, we are calling on the government to go further and faster to ensure help is delivered. To find out more about our Refugees Welcome campaign, click here . To sign the petition click here . If you would like to donate then please click here for our GoFundMe page. ",Broadsheet,0,2022-03,0,Conditions
2255,urc_theindependent_raw1.docx,The Independent,22/9/2023,294 words,Via AP news wire,Germany considering short-term migration border controls with Poland and the Czech Republic,"Germany is considering establishing short-term border controls with Poland and the Czech Republic to keep irregular migrants from entering the country, a government official said Friday. Interior Minister Nancy Faeser told German newspaper Welt am Sonntag that setting up temporary police checks on border crossings would help Germany prevent the smuggling and trafficking of people. She added that the increased border checks would need to be combined with the already ongoing random police checks that are being carried out. Germany, Poland and the Czech Republic belong to the European Union's visa-free zone, commonly known as the Schengen Area. “Respective additional border police measures are currently being reviewed,” a German Interior Ministry spokesperson told the German news agency dpa. Faeser is also discussing with the Czech Republic the possibility of German police officers operating on Czech territory, similar to an agreement that Germany has struck with Switzerland.  “In close coordination with Swiss police forces, German police officers are allowed to inspect on Swiss territory and to prevent unauthorized entry (into Germany),"" the minister said. Faeser also demanded closer cooperation on migration between the EU and Turkey, and said that the current EU-Turkey deal required an “update.” The number of people who migrated to Germany in 2022 was higher than in any other year, according to the German federal statistics agency Destatis, with about 2.67 million people having entered the country in 2022. Included in the number are 1.1 million Ukrainian refugees who sought safety in Germany after Russian launched a full-scale invasion of Ukraine in February 2022. ___ Follow AP’s coverage of migration issues at https://apnews.com/hub/migration",Broadsheet,0,2023-09,0,Policy
3386,urc_theindependent_raw4.docx,The Independent,16/11/2022,186 words,Namita Singh,Rishi Sunak news -live: Hunt expected to lift cap on bankers’ bonuses in Autumn Budget,"Jeremy Hunt is likely to lift the cap on bankers’ bonuses when he delivers his Autumn Budget tomorrow, part of a range of measures designed to restore the UK’s economic credibility. The Financial Times first reported the chancellor will make the lifting of the cap one of the few measures to survive from Kwasi Kwarteng ’s disastrous mini-Budget, amid speculation about the “difficult decisions” that Mr Hunt and the prime minister are likely to take as they try to find up to £60bn from a combination of hikes and spending cuts. Earlier, Rishi Sunak urged banking executives “to embrace pay restraint” in order not to exacerbate inflation. The Budget is widely expected to raise finances through stealth taxes by freezing the rates at which workers begin paying higher rates of tax, with inflation and pay increases dragging more people into higher bands. But tough spending cuts are likely too, with Mr Hunt reportedly eyeing up plans to cut funding for the government’s homes for Ukrainian refugees scheme and planning to reduce funds received by councils for some of the services for refugees hosted by UK families. ",Broadsheet,0,2022-11,0,Policy
1851,urc_theindependent_raw1.docx,The Independent,2/12/2022,570 words,Lauren Gilmour,Ship hosting Ukrainian refugees has contract extended by five months,"Ukrainian refugees will spend a further five months on a ship which has been accommodating them since June this year, the Scottish Government have confirmed. The MS Victoria , which is docked in Leith, Edinburgh , will continue to provide “safe accommodation for displaced people” until June 2023 with the option to extend. Scottish Liberal Democrat leader Alex Cole-Hamilton, however, accused the Scottish Government of “quietly” extending the contract, according to reports by LBC on Friday. On Friday evening, Mr Cole-Hamilton told the PA news agency: “This isn’t a new life, it’s a new limbo. Ukrainian refugees deserve a long-term solution. “I spoke to aid workers, working in Lviv, connecting Ukrainian refugees fleeing to Scotland with homes and routes out of Ukraine, who have described the Scottish Government as being humiliatingly underprepared. “They wanted the kudos of throwing open their doors but they did none of the groundwork. “I don’t think when these Ukrainians are fleeing unimaginable atrocities at the hands of the Russians, I don’t think they dreamed about a very crowded passenger ship.” Appropriate long-term accommodation is yet to be identified. Minister with Special Responsibility for Refugees from Ukraine Neil Gray said: “We do not want people to spend any longer than is absolutely necessary in temporary welcome accommodation, however, we know from speaking to those on board the MS Victoria that it is a safe environment that has built a powerful sense of community. “We’ve extended the contract with the MS Victoria to continue to safely accommodate arrivals from Ukraine. Work continues to match people in temporary accommodation with hosts and matching teams are operating on board both ships. “Across Scotland work is under way to increase the availability of suitable and sustainable longer-term accommodation. The Scottish Government continues to work closely with local authority partners to increase longer-term housing opportunities for displaced people across Scotland. “We’ve provided up to £50 million of funding for local authorities and registered social landlords to bring void properties back into use and increase the available housing supply. “This includes the recent allocation of more than £6 million from the Ukraine Longer Term Resettlement Fund to Aberdeen City Council to bring around 500 void properties back into use.” The Scottish Government has urged members of the public to volunteer as hosts for refugees from Ukraine currently in short-term accommodation. Mr Gray added: “We would encourage anyone considering becoming a host to come forward and provide a warm welcome. In recognition of this commitment, hosts can receive thank you payments for up to 12 months. “I’m extremely grateful to people who are already hosting, as well as those who have already put their details forward and are still waiting to be matched. “I’m proud of the warm welcome the people of Scotland have given to those fleeing the war and the support we are providing to so many thousands of people.” More than 21,500 people with a Scottish sponsor have arrived in the country since the Russian invasion of Ukraine earlier this year, representing 20% of all UK arrivals. The ship is currently accommodating around 1,275 refugees including families and children. All options are being explored with the MS Ambition which is currently docked in Glasgow and has been chartered until February 2023.",Broadsheet,0,2022-12,0,Conditions
2986,urc_theindependent_raw3.docx,The Independent,31/3/2022,641 words,NA,Ukrainian family stranded in Hawaii are given a house for free,"A Ukrainian family who became stranded in Hawaii when the war broke out during their vacation have been given a new temporary home to live in rent-free on the island. Vasyl and Marina Prishchak and their three daughters Maria, 16, Sofia, 10, and Kseniia, 5, travelled from their home in Kyiv to Oahu for a long-awaited holiday visiting their friends Borys and Beata Markin in the middle of February. But, just days into their three-week trip, their dream holiday turned to heartbreak as Russia declared war on Ukraine and they found themselves watching from afar as their home country came under attack. More than one month on, with the planned vacation now over, they remain stuck in the US not knowing if their home close to a Ukrainian military base is even still standing or if they will ever be able to return home. Their cosmetics company has been forced to close and access to their finances has been cut off, according to the Associated Press. The canoe paddling community has rallied around the family in their time of need, with one local homeowner giving them a cottage to stay rent-free for as long as they need in Kaneohe. Thousands of dollars have been raised in donations to support the displaced family, with a GoFundMe organised by one local reaching more than $33,000 on Thursday. Meanwhile, others are helping them in other ways, such as supporting them with immigration questions as they apply for Temporary Protected Status (TPS). In early March, President Joe Biden announced he was granting TPS to Ukrainians fleeing from the war, enabling Ukrainians to stay and work legally in the US for 18 months. An estimated 75,000 people will be shielded from deportation back to the war zone because of this rule. The Prishchaks said they are thankful for the outpouring of support they have received from the local community in the US.  Mr Prishchak, who has known Mr Markin for three decades, told AP that ""this vacation changed our life"". ""We don't know how we return to Ukraine and what we will do, we will begin from zero, from scratch,"" he said. He said that he feels guilty being on a beautiful island away from his home while his fellow Ukrainian men are unable to leave the country and are now fighting on the frontline. ""It's a really terrible feeling that eats away at you from inside when you understand that all your close relatives are now in a very complicated situation,"" he said.  ""And there's no way you can help them stop this absolute insanity. It's a feeling that simply eats you up inside, you could say.  ""A horrible sensation, an inner guilt that I'm here and not there."" Ms Markin, who has lived with her Ukrainian husband in Hawaii for eight years, said she sees it as ""our responsibility to make sure they are okay here"" as they ""have nowhere to go"". Charlotte Johnson, an Oahu resident who set up the GoFundMe, called on her fellow Americans to ""bring hope to their lives by sharing our aloha"". ""Sadly, we can't help all the Ukrainians, but we can help this family of five,"" she wrote on the fundraising page. ""None of us can even imagine going on a vacation only to find the life left no longer exists."" She added: ""Even the smallest donation will make a difference. To a country half a world away, these five Ukrainians are our touchpoint.  ""Today we can help this Ukrainian family who took a vacation and will never return to the home they knew."" Last week, on the one-month anniversary of the day the war began, Mr Biden unveiled plans to welcome up to 100,000 Ukrainians and other refugees fleeing the country into the US. He also pledged to provide $1bn in humanitarian assistance to help with the rising humanitarian crisis as more than 4 million refugees have now left their homes in Ukraine. It's a move that comes after pressure was mounting on the US from European counterparts to do more to support Ukrainian refugees.",Broadsheet,0,2022-03,1,Aid
