ID,Source_File,Newspaper,Date,Length,Author,Headline,Article,Newspapertype,Rightwing,year_month,Solidarity,Category
349,urc_dailyexpress_raw.docx,Daily Express,8/3/2022,104 words,IAN BAKER,U'S FOR UKRAINE,"COLCHESTER will be donating their entire gate receipts from their live Sky clash with Forest Green to Ukrainian refugees. . t The U's will charge £10 a ticket for the League Two match on March 21 and hope to play in a special yellow and blue kit. The club hope to raise as much as £50,000 from the gesture. Chairman Robbie Cowling, below, has also asked those entitled to complimentary tickets to pay in the 'Game for Ukraine' fixture. UKRAINE H mfe b th He said: ""I'm sure many of you are feeling devastated by the events in the Ukraine. ""I have wondered what can be done to help those that have been forced out of their homes."" ca",Tabloid,1,2022-03,1,Aid
333,urc_dailyexpress_raw.docx,Daily Express,14/3/2022,74 words,NA,Cold shoulder for refugees but not Channel migrants; Letters,"COULD someone explain to me how it is that Ukrainian refugees with very good reason to come here are having to jump through hoops to do so (""Priti relaxes UK visa rules for refugees"", March 11)? Every day we are told the number of economic migrants arriving on dinghies without the correct paperwork, if any at all.They are picked up, driven to hotels, given money, etc, while genuine cases are facing major hurdles. Christine Brough, Harborne, W Mids",Tabloid,1,2022-03,1,Migration
353,urc_dailyexpress_raw.docx,Daily Express,16/5/2022,145 words,Catherine Lough,Culture courses for UK hosts,"FAMILIES hosting Ukrainian refugees are being offered lessons on its culture and language to help their guests feel at home. The Open University (OU) will launch the online course later this summer. Free online English lessons and mental health support for Ukrainians will also be available. The OU has waived fees for current Ukrainian students and is offering 12 sanctuary scholarships, worth £240,000, to prospective applicants. Vice-chancellor Tim Blackman said the university is ""appalled"" by the war and wants to support people ""in the best way we can, by providing free online learning, scholarships and financial assistance for Ukrainians as they seek refuge in the UK, as well as educational resources for hosts"". He added: ""We believe that accessible education is a powerful tool for improving people's lives and will continue to mobilise resources to show our support.""",Tabloid,1,2022-05,1,Aid
250,urc_dailyexpress_raw.docx,Daily Express,5/11/2022,121 words,NA,'UKRAINIAN REFUGEES OUSTED FOR MIGRANTS',"ASYLUM seekers are to be moved from Kent to a hotel close to Rishi Sunak's constituency home. But the Home Office plan has been met with opposition after it was claimed refugees fleeing Ukraine are being relocated 30 miles away. Loc fam leNn Locals say seven Ukrainian families have been told to leave Allerton Court, in Northallerton, North Yorks, nine miles from the Prime Minister's £1.5million manor house in Kirby Sigston. MhT mov make w They say they are being moved to Stockton-on-Tees to way for Manston migrants. Hambleton District Council said the plan is going ahead despite concerns. A Home Office statement said: ""We have not yet taken occupancy of the hotel but have been assured there are no Ukrainians resident in it.""",Tabloid,1,2022-11,1,Conditions
363,urc_dailyexpress_raw.docx,Daily Express,6/5/2022,191 words,Frederick Forsyth,SLOW PROGRESS OF THE CIVIL SERVICE JOBSWORTHS MAKING BRITAIN UNFIT FOR PURPOSE,"THERE may well be some who feel I am too harsh in my comments on the degeneration of our Civil Service from excellent to disastrous but daily revelations bear me out. We needed the jobsworths to get our loyal helpers out of Afghanistan as the Taliban swept back in and Biden scuttled. Half of them were left desperate at Kabul airport while their visas were being shuffled. Thank you, Foreign Office.We wanted to welcome Ukrainian refugees, mostly women and children, fleeing Putin's savagery. Many queued in Polish snow waiting for their paperwork to be finalised. Thank you Home Office. Government has admitted DVLA Swansea has simply disintegrated. Now the Passport Office has gone the same way. That comes under the Home Office and so Priti Patel.When she complains the performance of her own department is not good enough the perm sec, Matthew Rycroft whines ""You are being unkind to us."" It's quite OK by him if the head of the Passport Office stays sipping coffee at home. Now Michael Gove has weighed in for Priti Patel. Covid, the universal excuse for bone idleness, won't work any more. Never mind the public, even ministers have had enough.",Tabloid,1,2022-05,1,Conditions
311,urc_dailyexpress_raw.docx,Daily Express,4/5/2022,109 words,Michael Knowles,"REFUGEE VISAS WERE NOT QUICK ENOUGH, ADMITS PM","THE Prime Minister has admitted that the Government could have been quicker in helping Ukrainian refugees fleeing Vladimir Putin's brutal war. Boris Johnson said ""large numbers"" of those seeking refuge are now coming to Britain. But the bungled start to the visa schemes designed to help Ukrainian refugees left many families in limbo, with some forced to wait in other European countries while their UK visa applications are processed. The PM said: ""So far, 86,000 visas have been issued and 27,000 are already here. Could we have done it faster? Yes, perhaps we could."" But he added: ""It's important to protect the system from those who might want to abuse it.""",Tabloid,1,2022-05,1,Policy
267,urc_dailyexpress_raw.docx,Daily Express,22/3/2022,387 words,Hanna Geissler,Tiny but welcoming village in Moldova is an example to world,"THE residents of a tiny village in one of Europe's poorest countries have set a heartwarming example by opening their homes to hundreds of Ukrainian refugees. Palanca in south-east Moldova has a population of 2,000 but is one of the main border crossings for those fleeing the war. Its mayor, Dumitru Cozlovschi, said he was proud of the way his people responded to the sudden influx of evacuees. He said: ""I was not surprised. I knew that Moldovans are kind and helpful in times of need. But I was not sure how many families could actually host somebody."" In the immediate aftermath of Vladimir Putin's onslaught, the free bus system that now ferries people to Romania or larger Moldovan cities had yet to be set up. Some refugees - mostly women and children - crossed the border with no idea what their next step would be. Mr Cozlovschi began calling residents to ask whether they would take people in. Half of the remote village's 250 homes have volunteered. And since the war started 1,000 refugees have been registered as staying in Palanca for at least one or two weeks. Mr Cozlovschi said the true figure is likely to be higher. Around 200 adult refugees and 80 children are still living in Palanca. Among them is Diana Avetisian, 20, who fled Odesa with her boyfriend and his family. They are staying at Casa Veche guesthouse, one of three in the village supported by the United Nations Development Programme (UNDP). She said: ""We heard the sound of bombing and decided to pack our stuff and get out."" Diana's boyfriend Roman Riabykh, 25, crossed the border just an hour before men aged 18 to 60 were banned from leaving Ukraine. They were with his mum Marina Vinogridova, 44, and brother Hleb, nine. Diana said she was grateful to be able to stay close to the border and her parents, who remain in Odesa. She added: ""It's amazing. We didn't expect Moldovan people to treat us so well. Everyone seems to be so friendly, so hospitable and we were so blessed."" ? A GROUP of Ukrainian orphans due to fly to the UK are stuck in Poland after key paperwork was not provided in time by their government. The 52 travellers, aged two to 19, and their carers were due to fly from Warsaw to London yesterday before making their way to Scotland later in the week. Charity Dnipro Kids in Edinburgh is now looking at alternative travel options. Graphic   Safe...Diana, Marina and Hleb, nine",Tabloid,1,2022-03,1,Conditions
229,urc_dailyexpress_raw.docx,Daily Express,28/11/2023,384 words,Michael Knowles,Gove blames lack of housing on arrivals but admits homes failings,"MICHAEL Gove says mass migration has fuelled the housing crisis. The minister said Government must increase homes being built and cut the legal entry of people. This comes after net migration has hit new records. More than a million people came to Britain to live in the past year as the Government faces political pressure to reduce arrivals. Asked if the UK did not have the number of homes to match the demand from immigrants, the Housing Secretary told Times Radio: ""Migratory flows put more pressure on housing but we haven't built enough homes overall for generations. ""This Government is going to hit its target of a million new homes in this Parliament but we do need to go further. This year, I outlined a long-term plan for housing, which will allow us to build more homes, particularly making effective use of brownfield land."" With net migration of 745,000 last year, the Government would need to massively increase housebuilding and significantly reduce immigration to meet the challenge, he said. Mr Gove added: ""It's important when looking at the migration figures to recognise some of these figures are students, some are Ukrainian refugees, some are British nationals from Hong Kong. ""But we need to bring migration down. And we need to build more homes."" Meanwhile, an g using val com- ""acute and overlooked"" shortage of affordable housing poses a threat to the survival of communities in rural England, a countryside charity warned. y ng ryside ices, Locals are being driven out of the countryside by record house prices, low wages and a surge in second homes and short-term lets, the CPRE reveals in a report published today. Its chief erm n g Roger Mortlock said: ""Decades of inaction have led to an affordable housing crisis that is ripping the soul from our rural communities. The next government must set and deliver ambitious targets for new, affordable and social rented rural h ripp r ties. ment mu am a housing, curbing the boom of second homes and short-term lets."" It would take 89 years to clear the social housing waiting list under the current build rate, a CPRE report found. A Government spokesperson said: ""We are unlocking a new pipeline of rural housing by reforming our planning system and offering greater freedoms on farm buildings to support a new supply of affordable homes."" Graphic   Long-term plan...GoveR. Rural concern ...MortlockBuild issue...homes shortfall 'for generations'",Tabloid,1,2023-11,0,Policy
345,urc_dailyexpress_raw.docx,Daily Express,20/4/2022,116 words,Ann Widdecombe,Archbishop needs to do home work,"AMID all the concern for Ukrainian refugees, let us not forget the Afghan interpreters. It is reported that some of those who fled Afghanistan and were brought here for their own safety are still in hotels after eight months. At the last count this applied to some 11,500 refugees whose lives are on hold while they wait for stable settlement. That is scandalous in human terms and vividly illustrates the problems of settling perfectly lawful and welcome immigrants in proper homes. Perhaps the Archbishop of Canterbury, above, who decries the Government's efforts to stem the flow of channel crossings and people trafficking as ""ungodly"" could tell us where all the illegal ones are going to be put?",Tabloid,1,2022-04,1,Conditions
343,urc_dailyexpress_raw.docx,Daily Express,5/4/2022,106 words,NA,"JUST 4,700 REFUGEES GIVEN A VISA","ONLY around one in 10 Ukrainian refugees hoping to be hosted by a British family has been granted a visa so far, figures show. Of 32,200 people who have applied to come to the UK under the Homes for Ukraine scheme, just 4,700 have one. Downing Street said a further 32,800 have applied to join family under another system and 24,400 were given permission. But No10 was unable to say how many refugees have so far arrived in the country. The Prime Minister's spokesman said the Government was ""working to streamline the process"". Welsh Secretary Simon Hart denied the Home Office had become complacent amid growing ""frustration"". COMMENT: PAGE 12",Tabloid,1,2022-04,1,Policy
108,urc_dailymail_raw.docx,Daily Mail,13/3/2022,556 words,Glen Owen,'Ultimate payback for Putin's cronies'; But Cabinet splits over Gove plan to house refugees in oligarch mansions,"WHEN Michael Gove launched into some of his typically rousing rhetoric at Cabinet last month, calling passionately for the mansions of Russian oligarchs to be seized and opened up to Ukrainian refugees, Boris Johnson murmured his assent. But a fortnight later, the Levelling Up Secretary is still fighting to overcome resistance to his idea from the Treasury and Foreign Office, where officials shiver at what one source dismissed as 'banana republic politics'. For their part, supporters of Mr Gove's plan describe the opponents as 'oligarch apologists'. The debate flared up again last week at the first meeting of a Cabinet sub-committee on Ukraine, chaired by Downing Street's chief of staff Steve Barclay, which has been tasked with examining 'every facet' of the UK's refugee response. When Mr Gove highlighted the powerful symbolism of his proposed move, Foreign Office Minister James Cleverly and Treasury Minister John Glen voiced their departments' reservations. Under Mr Gove's plan, British property owned by oligarchs sanctioned because of the war would be taken over by the Government for as long as they remained on the list, allowing Ministers to throw open their doors to refugees. In the case of Roman Abramovich, Britain's most high-profile oligarch, that would release at least 70 properties, worth around £500million, The portfolio includes a 15-bedroom mansion at Kensington Palace Gardens with an estimated value of £150 million, and a three-storey penthouse in the Chelsea Waterfront tower, bought for £30million in 2018. Abramovich had his assets - including Chelsea FC - frozen on Thursday as part of Government sanctions. Another sanctioned oligarch, aluminium tycoon Oleg Deripaska, worth £2 billion, owns a £50million property on Belgrave Square in Central London, via a company registered in the British Virgin Islands, and Hamstone House on the exclusive St George's Hill estate near Weybridge, Surrey. The eight-bedroom mansion includes a swimming pool, sauna, gym and extensive gardens. Mr Gove's plan echoes moves by the US Congress to seize assets from oligarchs whose wealth is linked to Vladimir Putin. Under a bill introduced earlier this month, American authorities would be allowed to go further than Mr Gove's plan by confiscating, rather than just seizing, any property - including luxury villas, yachts, and airplanes - valued more than $5million with the funds used to benefit the Ukrainian people via military or humanitarian aid. Supporters of Mr Gove's plan also point the finger at No10's new head of policy, Andrew Griffith, for trying to block it. Mr Griffith, the Arundel MP, is a former Rothschild banker and chief financial officer for Sky TV, who is understood to have argued that the idea is not 'legally workable'. An opponent of the Gove plan said: 'This is gesture politics more suited to a banana republic'. But a supporter said: 'The opposition is being led by oligarch apologists who hide behind the rule of law. These people have been sanctioned for a reason, and no one who has been placed on the sanctions list has ever come off it. This is the ultimate symbolic payback for Putin's cronies.' Downing Street declined to comment and a spokesman for Mr Gove said: 'We don't comment on private Cabinet discussions.' Moral justice - or 'gesture politics more suited to a banana republic'?",Tabloid,1,2022-03,1,Policy
48,urc_dailymail_raw.docx,Daily Mail,15/3/2022,232 words,BY DAILY MAIL REPORTER,Q & A,"How do I take part in the refugee scheme? Enter your details on the official website, homesforukraine.campaign.gov.uk Who can apply? Anyone can volunteer to be a host, but initial sponsors are likely to have connections with specific refugees. How many refugees can I host? That depends on how much space you have. You will be asked how many spare rooms are in your property. What happens next? From later this week, Ukrainian refugees will be able to apply for a UK visa through the Homes for Ukraine scheme. How long can they stay in Britain? A visa allows them to stay for up to three years with the right to work, access the NHS and claim most benefits. Councils will be given a grant of £10,500 per refugee to provide support with extra for the costs of schooling. What must hosts do? They will be expected to accommodate the evacuees for a minimum of six months. Each participating household will be given a £350-a-month thank you' from the Government. Could their benefits or taxes be affected? No. The £350 a month is tax-free. Mr Gove said taking a refugee into your home will not affect a host's benefits or their council tax status, for example claims for single occupancy discount. What safety checks are in place? British hosts will have to undergo only very light-touch' criminal records checks, while the refugees will be vetted against British and international security databases. © Daily Mail",Tabloid,1,2022-03,1,Aid
115,urc_dailymail_raw.docx,Daily Mail,10/3/2022,1276 words,"BY DAVID BARRETT, JASON GROVES AND GREGORY KIRBY",VISAS: WHEN WILL PRITI GET A GRIP?,"PRITI Patel is expected to bow to pressure and fix the shambolic refugee scheme amid reports that the Prime Minister is losing faith in her handling of the crisis. Scores of Ukrainian evacuees expressed their frustration at British red tape yesterday, including some sent to a Home Office centre in Lviv in the war-torn country that had shut down days earlier. It was announced last night that 100 British military personnel in civilian dress are going to Poland to help organise the visa application centre (VAC) in Warsaw. It came as former prime minister David Cameron suggested the UK's programme should be more generous. One option could be allowing Ukrainians into Britain just by showing their passports, he told LBC's Tonight with Andrew Marr, adding: Let's find a way to get it done.' The Daily Mail understands the Home Secretary is planning to unveil significant moves to streamline the refugee scheme and open it to all Ukrainians with family in Britain, although she will stop short of dropping visa requirements altogether. New measures will mean Ukrainians already here for work or on other short-term visas will be able to apply for a free three-year visa that will let them to bring relatives here, Home Office sources said. Until now the refugee scheme has been limited to relatives of Ukrainians with permanent rights to be in the UK. In further moves planned by ministers, refugees who have visited Britain in the past five years will be able to re-use biometrics from earlier visa applications. This will aim to reduce bottlenecks at VACs across the continent where refugees must attend appointments to have fingerprints and facial scans taken. The number of refugee visas granted so far reached 957 yesterday as the Education Secretary predicted Britain will end up taking in around 200,000. Nadhim Zahawi, whose family fled Saddam Hussein's Iraq, told The Spectator the Government had struck the right balance because it's right to have some checks as to who we're settling here'. The planned changes to the visa scheme come amid fierce criticism of Britain's existing set-up. A senior Tory source said: Priti Patel's stock is falling fast. People want us to be generous, the Prime Minister is saying he wants to be generous, but reality on the ground is making a mockery of that. The Home Office has to stop looking at this from the point of view of trying to control numbers. The point of controlling our borders is we can choose to be generous when circumstances demand.' Another Whitehall insider said: Priti has not got a grip on this. What we are seeing is the classic Home Office approach of trying to bureaucratise everything and squeeze the numbers, which is the opposite of what the PM is asking for - it's not surprising he's getting frustrated with her.' An ally of Miss Patel acknowledged it was taking time to get the process running smoothly but said it was not fair to blame it all on her'. The source voiced irritation with Michael Gove's Department for Levelling Up, Housing and Communities, which has yet to produce details of the new sponsorship route' for refugees. Priti is getting all the flak for refugees, but there is nothing she can do about the sponsorship route until Gove has decided what it is,' the source said. Downing Street insisted yesterday that Boris Johnson still has full faith' in the Home Secretary. Ukraine's ambassador to the UK Vadym Prystaiko also criticised bureaucratic hassles' yesterday, telling the Commons home affairs committee that, for example, biometric checks should be dropped for child evacuees. A pop up' VAC will open in Lille, France, today but will only deal with applicants referred by Border Force officers at Calais, where hundreds of Ukrainian refugees have already turned up. Other applicants are being urged to go to other centres across Europe. But a British-Ukrainian sales manager Vitalii Morgun, 36, who drove to the Hungarian border with Ukraine to collect family who had fled, said that when they reached the Brussels VAC he was shocked to find just two officials on duty. It's a joke… it's hopeless,' he said. And a British citizen, Joe from Hampshire, who flew to Poland to help get his mother and niece to the UK, said the Home Office told him to apply for visas in Lviv - even though the centre has shut. He told The Daily Telegraph: Basically the Home Office staff don't have the same information as the people do on the ground.' Enver Solomon, of the Refugee Council charity, told MPs the Government was placing paperwork over people'. Comment - Page 20   WE DROVE 1,600 MILES... THEN UK TURNED US AWAY A UKRAINIAN mother and daughter who drove 1,600miles from Kyiv were turned away in Calais by UK border staff who shrugged' as they pleaded to be let through as refugees. Alena Semenova, 22, and Tetyana Tsybanyuk, 40, had bought a ticket on an Irish Ferries sailing to Dover and had passed the French border, but were stopped by seemingly indifferent British officials who detained them like criminals' because they did not have visas. Miss Semenova, a former medical student trying to reach her godparents in Glasbury, Powys, said: We did not understand what was happening, why we were detained as criminals. But the border guard officer shrugged her shoulders and said that they would not let us through without a visa.' They then had to drive 180 miles to Paris where they are hoping to gain visas. But this will only happen if the Government eases restrictions for Ukrainians without relatives in Britain. Her godfather, Graham Blackledge, a chiropodist whose wife Alla is also from Kyiv, said: Let them come over, house them, feed them, look after them. And then if you want to start processing them, but in the first instance help. And to accuse those seeking sanctuary in Britain of perhaps being Russian spies trying to infiltrate the UK, you should be ashamed of yourself.' At the Polish processing centre, Natalia Honcharyk, a 28-year-old marketing executive from Kyiv, said: It's not like we are going on holiday. We only want to get to Britain to seek safety there.' She and her 37-year-old sister, Viktoriia Kudlysheva, a civil servant, hope to stay with a cousin in Bristol. We are unsure if our application will be accepted here because we had originally booked an appointment in Lviv,' Viktoriia said.   THE TORTUOUS PROCESS FOR GAINING ENTRY Ukrainian refugees hoping to come to the UK must go through the following painstaking process under the Government's Family Visa Scheme: Create an online account on the Home Office website and fill in a detailed application form. Upload proof their qualifying family member has permanent residence status in Britain, such as a copy of the Home Office vignette in their family member's passport. Upload proof they had been living in Ukraine before January 1 this year. Provide evidence they are related to the qualifying family member in Britain, such as birth certificates or marriage certificates. If documents cannot be provided, applicants must explain why you are unable to do so'. Translate all above documents into English and upload them to the website. Book and attend an in-person appointment at a Home Office visa application centre in Poland, Hungary, Romania, Moldova or France so officials can take biometrics - fingerprints and a facial scan. The booking system frequently crashes and there are reports the earliest slots available are in two weeks' time. Although normal visa requirements for a tuberculosis vaccination certificate have been waived, some applicants have mistakenly been asked to provide them. Wait while the application is decided by caseworkers in the UK and security checks are carried out. © Daily Mail",Tabloid,1,2022-03,1,Policy
